submission_id,age,alternatives,answer,category,comments,condition,correct_response,education,gender,itemName,languages,responseTime,trialNr,trial_type
3968,26,optionB,"O sorry, i do not access Facebook, i am only on Instagram.",fullList,,question_optionA|no,NA,Graduated College,male,socialMedia,English,144839,2,main
3968,26,optionA|optionB,"Yes we do, it is available.",taciturn,,question_optionA|yes,NA,Graduated College,male,foodCourt,English,215128,3,main
3968,26,optionA,"Yes, we do!",taciturn,,question_optionA|yes,NA,Graduated College,male,videoGames,English,133488,4,main
3968,26,optionB|optionC,"Here are our options, which would you prefer? electric scooters, mopeds, and electric bikes.",error,,question_any,NA,Graduated College,male,dricersLicense,English,142200,5,main
3968,26,NA,motorcycle,,,filler,motorcycle,Graduated College,male,carRental-moving,English,40471,6,filler
3968,26,optionC,"No, what is nearby is a coffee shop of Cafe Nero.",fullList,,question_optionA|no,NA,Graduated College,male,coffeeShop,English,149359,7,main